Name,Address,Phone number,Website,Rating,Number of ratings,Governorate,location Link,Plus code,Latitude,Longitude
Salam Mall,"4CX9+MH4, Martial Passage, El-Salam Sharkeya, Al Salam First, Cairo Governorate 4645101",not available,Not available,5.0,2,Cairo,https://maps.app.goo.gl/12q5Ati3HtHpTXtL8,not available,30.148750,31.413750
Home (Family),"5C84+7JM, Al Khazan, As Salam Al Gharbeyah, Al Salam First, Cairo Governorate 4644032",not available,Not available,,,Cairo,https://maps.app.goo.gl/dLyHpXCpfT33H2Ne8,not available,30.165813,31.406562
Esplanade Cafe Restaurant,"InterContinental Cairo Citystars, Omar Ibn El-Khattab، Street, Heliopolis, Cairo Governorate 11737",02 24800009,Not available,5.0,150,Cairo,https://maps.app.goo.gl/d7QZwmLQA8rRSmiD6,38FX+G3 Heliopolis,30.073813,31.347687
أسماك ابو يوسف,"49PF+FPG, Berket an Nasr, Al Salam First, Cairo Governorate 4641121",not available,Not available,3.6,7,Cairo,https://maps.app.goo.gl/wkMdAQAaVC6Wko438,not available,30.136187,31.374313
McDonald's Chill-Out El-Salam,"محطة Chill-Out السلام،, Chill-Out El-Salam, Martial Passage, ممرات عسكرية،, El-Salam Sharkeya, Cairo Governorate",02 21600377,mcdelivery.eg,4.0,17,Cairo,https://maps.app.goo.gl/oqmrS4Cj8G9qdv846,"4CX9+PF El-Salam Sharkeya, Al Salam First",30.149313,31.418687
